{
  "has_changes": true,
  "summary": {
    "tables_added": 1,
    "tables_dropped": 1,
    "tables_renamed": 1,
    "columns_added": 1,
    "columns_dropped": 1,
    "indexes_added": 0,
    "indexes_dropped": 1,
    "foreign_keys_added": 0,
    "foreign_keys_dropped": 0,
    "constraints_added": 1,
    "constraints_dropped": 0,
    "enum_types_added": 1,
    "enum_types_dropped": 0,
    "sequences_added": 1,
    "sequences_dropped": 0
  },
  "changes": [
    {
      "type": "RENAME_TABLE",
      "table": "tb_order",
      "column": null,
      "old_value": "tb_order",
      "new_value": "tb_orders",
      "details": {
        "old_name": "tb_order",
        "new_name": "tb_orders"
      }
    },
    {
      "type": "DROP_TABLE",
      "table": "archive_log",
      "column": null,
      "old_value": null,
      "new_value": null,
      "details": {
        "columns": [
          {
            "name": "entry",
            "type": "TEXT",
            "nullable": true,
            "default": null
          }
        ],
        "constraints": []
      }
    },
    {
      "type": "ADD_TABLE",
      "table": "tb_post",
      "column": null,
      "old_value": null,
      "new_value": null,
      "details": {
        "columns": [
          {
            "name": "id",
            "type": "BIGINT",
            "nullable": false,
            "default": null
          },
          {
            "name": "user_id",
            "type": "BIGINT",
            "nullable": true,
            "default": null
          },
          {
            "name": "mood",
            "type": "mood",
            "nullable": true,
            "default": null
          }
        ],
        "constraints": [
          {
            "kind": "PRIMARY KEY",
            "name": "",
            "columns": [
              "id"
            ]
          },
          {
            "kind": "FOREIGN KEY",
            "name": "",
            "columns": [
              "user_id"
            ],
            "ref_table": "tb_user",
            "ref_columns": [
              "id"
            ],
            "on_delete": null,
            "on_update": null
          }
        ]
      }
    },
    {
      "type": "DROP_COLUMN",
      "table": "tb_user",
      "column": "legacy",
      "old_value": "TEXT",
      "new_value": null,
      "details": null
    },
    {
      "type": "ADD_COLUMN",
      "table": "tb_user",
      "column": "bio",
      "old_value": null,
      "new_value": "TEXT DEFAULT 'none'",
      "details": null
    },
    {
      "type": "CHANGE_COLUMN_TYPE",
      "table": "tb_user",
      "column": "age",
      "old_value": "INTEGER",
      "new_value": "BIGINT",
      "details": null
    },
    {
      "type": "CHANGE_COLUMN_NULLABLE",
      "table": "tb_user",
      "column": "email",
      "old_value": "false",
      "new_value": "true",
      "details": null
    },
    {
      "type": "DROP_INDEX",
      "table": "tb_user",
      "column": null,
      "old_value": null,
      "new_value": null,
      "details": {
        "name": "idx_user_legacy",
        "columns": [
          "legacy"
        ],
        "unique": false
      }
    },
    {
      "type": "ADD_UNIQUE_CONSTRAINT",
      "table": "tb_user",
      "column": null,
      "old_value": null,
      "new_value": null,
      "details": {
        "name": "uq_user_email",
        "columns": [
          "email"
        ]
      }
    },
    {
      "type": "ADD_ENUM_TYPE",
      "table": "mood",
      "column": null,
      "old_value": null,
      "new_value": null,
      "details": null
    },
    {
      "type": "ADD_SEQUENCE",
      "table": "seq_invoice",
      "column": null,
      "old_value": null,
      "new_value": null,
      "details": null
    },
    {
      "type": "ADD_FUNCTION",
      "table": "fn_one()",
      "column": null,
      "old_value": null,
      "new_value": "CREATE OR REPLACE FUNCTION fn_one() RETURNS integer LANGUAGE sql AS $$ SELECT 1 $$",
      "details": {
        "kind": "function",
        "name": "fn_one()",
        "keyword": "FUNCTION"
      }
    },
    {
      "type": "REPLACE_VIEW",
      "table": "v_user",
      "column": null,
      "old_value": "CREATE OR REPLACE VIEW v_user AS SELECT id, email FROM tb_user",
      "new_value": "CREATE OR REPLACE VIEW v_user AS SELECT id FROM tb_user",
      "details": {
        "kind": "view",
        "name": "v_user",
        "keyword": "VIEW"
      }
    }
  ],
  "ok": true,
  "command": "diff",
  "parser": {
    "pglast": "8.4",
    "pg_major": 18
  }
}
